{
  "schema_version": "1.0",
  "slideId": "slide_12",
  "layoutId": "TEAM_FTE_01",
  "sectionLabel": "TEAM",
  "title": "Who is needed and for how long",
  "subtitle": "Client and delivery roles for the first release",
  "sourceChapterIds": ["10"],
  "fieldProvenance": [
    { "path": "sectionLabel", "sourceChapterIds": ["10"] },
    { "path": "title", "sourceChapterIds": ["10"] },
    { "path": "subtitle", "sourceChapterIds": ["10"] },
    { "path": "roles[0].role", "sourceChapterIds": ["10"] },
    { "path": "roles[0].fte", "sourceChapterIds": ["10"] },
    { "path": "roles[0].responsibility", "sourceChapterIds": ["10"] },
    { "path": "roles[1].role", "sourceChapterIds": ["10"] },
    { "path": "roles[1].fte", "sourceChapterIds": ["10"] },
    { "path": "roles[1].responsibility", "sourceChapterIds": ["10"] },
    { "path": "roles[2].role", "sourceChapterIds": ["10"] },
    { "path": "roles[2].fte", "sourceChapterIds": ["10"] },
    { "path": "roles[2].responsibility", "sourceChapterIds": ["10"] },
    { "path": "roles[3].role", "sourceChapterIds": ["10"] },
    { "path": "roles[3].fte", "sourceChapterIds": ["10"] },
    { "path": "roles[3].responsibility", "sourceChapterIds": ["10"] },
    { "path": "summary[0].label", "sourceChapterIds": ["10"] },
    { "path": "summary[0].value", "sourceChapterIds": ["10"] },
    { "path": "summary[1].label", "sourceChapterIds": ["10"] },
    { "path": "summary[1].value", "sourceChapterIds": ["10"] },
    { "path": "summary[2].label", "sourceChapterIds": ["10"] },
    { "path": "summary[2].value", "sourceChapterIds": ["10"] }
  ],
  "roles": [
    {
      "role": "Process owner",
      "fte": "0.3",
      "responsibility": "Approve matching rules and exception decisions"
    },
    {
      "role": "AP operator",
      "fte": "0.5",
      "responsibility": "Work the exception queue during pilot"
    },
    {
      "role": "ERP specialist",
      "fte": "0.4",
      "responsibility": "Confirm posting path and test data"
    },
    {
      "role": "Delivery lead",
      "fte": "0.6",
      "responsibility": "Coordinate build, pilot and handover"
    }
  ],
  "summary": [
    { "label": "Total FTE", "value": "1.8" },
    { "label": "Milestones", "value": "4" },
    { "label": "Duration", "value": "14 weeks" }
  ]
}
